{
  "$schema": "https://json-schema.org/draft/2020-12/schema",
  "title": "Instrument",
  "type": "object",
  "required": ["instrument_id", "account_id", "relationship_id", "legal_entity_id", "line_of_business_id", "as_of", "cadence", "product_type"],
  "properties": {
    "instrument_id": {"type": "string"},
    "account_id": {"type": "string"},
    "relationship_id": {"type": "string"},
    "legal_entity_id": {"type": "string"},
    "line_of_business_id": {"type": "string"},
    "as_of": {"type": "string"},
    "cadence": {"type": "string"},
    "product_type": {"type": "string"},
    "currency": {"type": "string"},
    "notional": {"type": "number"},
    "rate": {"type": "number"},
    "maturity_date": {"type": "string"},
    "attributes": {"type": "object"}
  }
}
