{
  "instrument_id": "loan-001",
  "account_id": "account-credit-001",
  "relationship_id": "rel-synthetic-001",
  "legal_entity_id": "entity-bank-holdco",
  "line_of_business_id": "commercial-banking",
  "as_of": "2026-04-24T00:00:00Z",
  "cadence": "daily",
  "product_type": "commercial_term_loan",
  "currency": "USD",
  "notional": 10000000.0,
  "rate": 0.0525,
  "maturity_date": "2031-04-24",
  "attributes": {"secured": true, "amortizing": true}
}
